convert	"핵심 뜻: 다른 종교적 또는 정치적 신념으로 개종한 사람
부가 뜻: 어떤 것의 성격, 목적, 기능을 바꾸다
핵심 느낌: 학술 문맥에서 다른 종교적 또는 정치적 신념으로 개종한 사람이라는 핵심 개념을 잡는 느낌
구분: convert=다른 종교적 또는 정치적 신념으로 개종한 사람 / change over=유사어 / change=유사어"
couple	"핵심 뜻: 작은 불확실한 숫자
부가 뜻: 함께 사는 두 사람
핵심 느낌: 학술 문맥에서 작은 불확실한 숫자이라는 핵심 개념을 잡는 느낌
구분: couple=작은 불확실한 숫자 / mates=유사어 / match=유사어"
decade	"핵심 뜻: 10년의 기간
부가 뜻: 9와 1의 합인 기수;
핵심 느낌: 학술 문맥에서 10년의 기간이라는 핵심 개념을 잡는 느낌
구분: decade=10년의 기간 / decennary=유사어 / decennium=유사어"
definite	"핵심 뜻: 정밀한;
부가 뜻: 확실하게 알려져 있다
핵심 느낌: 학술 문맥에서 정밀한;이라는 핵심 개념을 잡는 느낌
구분: definite=기본형 / definitely=파생형 / definitive=파생형"
deny	"핵심 뜻: 사실이 아니라고 선언하다;
부가 뜻: 받아들이거나 믿기를 거부하다
핵심 느낌: 대상이나 상황을 사실이 아니라고 선언하다; 쪽으로 처리하는 느낌
구분: deny=사실이 아니라고 선언하다; / refuse=유사어 / abnegate=유사어"
differentiate	"핵심 뜻: 다르다고 표시하세요
부가 뜻: 독특한 특징, 속성 또는 특성이어야 하다
핵심 느낌: 대상이나 상황을 다르다고 표시하세요 쪽으로 처리하는 느낌
구분: differentiate=다르다고 표시하세요 / distinguish=유사어 / separate=유사어"
dispose	"핵심 뜻: 다른 사람에게 주거나 팔거나 양도하다
부가 뜻: 던지거나 버리십시오
핵심 느낌: 대상이나 상황을 다른 사람에게 주거나 팔거나 양도하다 쪽으로 처리하는 느낌
구분: dispose=다른 사람에게 주거나 팔거나 양도하다 / discard=유사어 / fling=유사어"
dynamic	"핵심 뜻: 효율적인 인센티브
부가 뜻: 행동이나 강력함, 성격의 힘이 특징입니다
핵심 느낌: 학술 문맥에서 효율적인 인센티브이라는 핵심 개념을 잡는 느낌
구분: dynamic=효율적인 인센티브 / moral force=유사어 / dynamical=유사어"
eliminate	"핵심 뜻: 종료하거나 제거하십시오
부가 뜻: 없애다
핵심 느낌: 대상이나 상황을 종료하거나 제거하십시오 쪽으로 처리하는 느낌
구분: eliminate=종료하거나 제거하십시오 / get rid of=유사어 / do away with=유사어"
empirical	"핵심 뜻: 이론보다는 실험과 관찰을 통해 도출되었습니다
부가 뜻: 의학적 속임수에 의존하다
핵심 느낌: 학술 문맥에서 이론보다는 실험과 관찰을 통해 도출되었습니다이라는 핵심 개념을 잡는 느낌
구분: empirical=이론보다는 실험과 관찰을 통해 도출되었습니다 / empiric=유사어"
equip	"핵심 뜻: 일반적으로 특정 목적을 위해 (무엇)을 제공하다
부가 뜻: 능력이나 이해를 제공하다
핵심 느낌: 대상이나 상황을 일반적으로 특정 목적을 위해 (무엇)을 제공하다 쪽으로 처리하는 느낌
구분: equip=일반적으로 특정 목적을 위해 (무엇)을 제공하다 / fit=유사어 / fit out=유사어"
extract	"핵심 뜻: 물질을 (보통 물에) 담그거나 담가서 얻은 용액
부가 뜻: 더 큰 작품에서 선택된 구절
핵심 느낌: 학술 문맥에서 물질을 (보통 물에) 담그거나 담가서 얻은 용액이라는 핵심 개념을 잡는 느낌
구분: extract=물질을 (보통 물에) 담그거나 담가서 얻은 용액 / infusion=유사어 / excerpt=유사어"
file	"핵심 뜻: 함께 보관되는 일련의 관련 기록(서면 또는 전자)입니다
부가 뜻: 사람이나 사물이 줄지어 늘어서 있다
핵심 느낌: 학술 문맥에서 함께 보관되는 일련의 관련 기록(서면 또는 전자)입니다이라는 핵심 개념을 잡는 느낌
구분: file=함께 보관되는 일련의 관련 기록(서면 또는 전자)입니다 / data file=유사어 / single file=유사어"
finite	"핵심 뜻: 크기나 공간적 또는 시간적 범위가 제한되거나 제한되다
부가 뜻: 동사;
핵심 느낌: 학술 문맥에서 크기나 공간적 또는 시간적 범위가 제한되거나 제한되다이라는 핵심 개념을 잡는 느낌
구분: finite=기본형 / infinite=파생형 / infinitely=파생형"
foundation	"핵심 뜻: 어떤 것이 근거가 되는 기초
부가 뜻: 기부금을 지원받는 기관입니다
핵심 느낌: 학술 문맥에서 어떤 것이 근거가 되는 기초이라는 핵심 개념을 잡는 느낌
구분: foundation=어떤 것이 근거가 되는 기초 / basis=유사어 / base=유사어"
globe	"핵심 뜻: 태양으로부터 세 번째 행성;
부가 뜻: 구형의 물체
핵심 느낌: 학술 문맥에서 태양으로부터 세 번째 행성;이라는 핵심 개념을 잡는 느낌
구분: globe=태양으로부터 세 번째 행성; / earth=유사어 / world=유사어"
grade	"핵심 뜻: 함께 가르치는 학생들의 모임
부가 뜻: 등급이 매겨진 그룹에서 상대적인 위치나 가치의 정도
핵심 느낌: 학술 문맥에서 함께 가르치는 학생들의 모임이라는 핵심 개념을 잡는 느낌
구분: grade=함께 가르치는 학생들의 모임 / class=유사어 / form=유사어"
guarantee	"핵심 뜻: 일부 제품이나 서비스가 제공되거나 특정 사양을 충족할 것이라는 서면 보증입니다
부가 뜻: 어떤 일이 일어날 것이라는 약속이나 어떤 일이 사실이라는 맹세
핵심 느낌: 학술 문맥에서 일부 제품이나 서비스가 제공되거나 특정 사양을 충족할 것이라는 서면 보증입니다이라는 핵심 개념을 잡는 느낌
구분: guarantee=일부 제품이나 서비스가 제공되거나 특정 사양을 충족할 것이라는 서면 보증입니다 / warrant=유사어 / warrantee=유사어"
hierarchy	"핵심 뜻: 시스템 내에서 사람이나 사물을 순서대로 배열한 일련의 그룹입니다
부가 뜻: 행정 기관에서 서로 다른 직위에 있는 사람들의 조직
핵심 느낌: 학술 문맥에서 시스템 내에서 사람이나 사물을 순서대로 배열한 일련의 그룹입니다이라는 핵심 개념을 잡는 느낌
구분: hierarchy=시스템 내에서 사람이나 사물을 순서대로 배열한 일련의 그룹입니다 / power structure=유사어 / pecking order=유사어"
identical	"핵심 뜻: 완전 똑같네;
부가 뜻: 완전 똑같은데;
핵심 느낌: 학술 문맥에서 완전 똑같네;이라는 핵심 개념을 잡는 느낌
구분: identical=완전 똑같네; / indistinguishable=유사어 / very=유사어"
ideology	"핵심 뜻: 집단이나 국가의 사고를 특징짓는 방향
부가 뜻: 상상적이거나 환상적인 이론화
핵심 느낌: 학술 문맥에서 집단이나 국가의 사고를 특징짓는 방향이라는 핵심 개념을 잡는 느낌
구분: ideology=집단이나 국가의 사고를 특징짓는 방향 / political orientation=유사어 / political theory=유사어"
infer	"핵심 뜻: 공제 이유;
부가 뜻: 보다 일반적인 경우를 위해 특정 사례를 활용하다
핵심 느낌: 대상이나 상황을 공제 이유; 쪽으로 처리하는 느낌
구분: infer=공제 이유; / deduce=유사어 / deduct=유사어"
innovate	"핵심 뜻: 환경에 새로운 것을 가져옵니다
부가 뜻: 받아 들여 쓰다
핵심 느낌: 대상이나 상황을 환경에 새로운 것을 가져옵니다 쪽으로 처리하는 느낌
구분: innovate=환경에 새로운 것을 가져옵니다 / introduce=유사어"
insert	"핵심 뜻: 다른 출판물의 페이지 사이에 접힌 부분
부가 뜻: 삽입되었거나 삽입될 아티팩트입니다
핵심 느낌: 학술 문맥에서 다른 출판물의 페이지 사이에 접힌 부분이라는 핵심 개념을 잡는 느낌
구분: insert=다른 출판물의 페이지 사이에 접힌 부분 / inset=유사어 / cut-in=유사어"
intervene	"핵심 뜻: 행동을 변경하거나 방해하기 위해, 또는 무력이나 무력의 위협을 통해 개입하다
부가 뜻: 다른 사물 사이에 배치되거나 배치되거나 공간과 이벤트 사이에 확장되다
핵심 느낌: 대상이나 상황을 행동을 변경하거나 방해하기 위해, 또는 무력이나 무력의 위협을 통해 개입하다 쪽으로 처리하는 느낌
구분: intervene=행동을 변경하거나 방해하기 위해, 또는 무력이나 무력의 위협을 통해 개입하다 / step in=유사어 / interfere=유사어"
isolate	"핵심 뜻: 배치하거나 따로 설정하다
부가 뜻: 순수한 형태로 얻습니다
핵심 느낌: 대상이나 상황을 배치하거나 따로 설정하다 쪽으로 처리하는 느낌
구분: isolate=배치하거나 따로 설정하다 / insulate=유사어 / sequester=유사어"
media	"핵심 뜻: 사람들에게 널리 다가가고 영향을 미치는 인터넷, 신문, 잡지, 텔레비전 및 기타 의사소통 수단(보통 복수 동사와 함께 사용됨)
부가 뜻: 매체의 복수
핵심 느낌: 학술 문맥에서 사람들에게 널리 다가가고 영향을 미치는 인터넷, 신문, 잡지, 텔레비전 및 기타 의사소통 수단(보통 복수 동사와 함께 사용됨)이라는 핵심 개념을 잡는 느낌
구분: media=문맥상 핵심 의미를 우선 확인"
mode	"핵심 뜻: 어떤 일이 어떻게 이루어지거나 어떻게 일어나는지
부가 뜻: 특정 기능 조건 또는 배열
핵심 느낌: 학술 문맥에서 어떤 일이 어떻게 이루어지거나 어떻게 일어나는지이라는 핵심 개념을 잡는 느낌
구분: mode=어떤 일이 어떻게 이루어지거나 어떻게 일어나는지 / manner=유사어 / style=유사어"
paradigm	"핵심 뜻: 단어의 모든 굴절 형태를 체계적으로 배열한 것입니다
부가 뜻: 표준 또는 전형적인 예입니다
핵심 느낌: 학술 문맥에서 단어의 모든 굴절 형태를 체계적으로 배열한 것입니다이라는 핵심 개념을 잡는 느낌
구분: paradigm=단어의 모든 굴절 형태를 체계적으로 배열한 것입니다 / prototype=유사어 / epitome=유사어"
